{
  "schemaVersion": 1,
  "id": "material_capsule_toolbar_size_dark",
  "profile": "material_shape",
  "canvas": {
    "logicalWidth": 402,
    "logicalHeight": 874,
    "scale": 3
  },
  "shape": {
    "kind": "capsule",
    "x": 89,
    "y": 390,
    "width": 224,
    "height": 94,
    "cornerRadius": 47,
    "appleContentInsetX": 0,
    "appleContentInsetY": 0
  },
  "appearance": "dark",
  "transparency": {
    "reduceTransparency": false,
    "appleSliderMapped": false
  },
  "probes": [
    {
      "id": "A",
      "background": {
        "kind": "rgbwGrid",
        "cellSize": 12,
        "gutter": 1,
        "gutterColor": "#101010",
        "layout": "primary",
        "colors": [
          "#FF0000",
          "#00FF00",
          "#0000FF",
          "#FFFFFF"
        ],
        "markerColumn": 2,
        "markerRow": 3,
        "marker": [
          "RGBWWBRG",
          "WRBGRGBW",
          "BGWWRBRG",
          "RRGWBBGW"
        ]
      }
    },
    {
      "id": "B",
      "background": {
        "kind": "rgbwGrid",
        "cellSize": 12,
        "gutter": 1,
        "gutterColor": "#101010",
        "layout": "holdout",
        "colors": [
          "#FF0000",
          "#00FF00",
          "#0000FF",
          "#FFFFFF"
        ],
        "markerColumn": 23,
        "markerRow": 56,
        "marker": [
          "WGBRRWBG",
          "BRWWGGRB",
          "RWBGBWRG",
          "GGRBWWBR"
        ]
      }
    },
    {
      "id": "C",
      "background": {
        "kind": "solid",
        "color": "#000000"
      }
    },
    {
      "id": "D",
      "background": {
        "kind": "solid",
        "color": "#FFFFFF"
      }
    }
  ]
}
